shipToCode;shipToName;shipToAddress1;shipToAddress2;shipToCity;shipToPostalCode
"201338";"Doctor Jay Medical Ctr- Dr Lim Jiun Jye";"115 Killiney Rd.";"";"Singapore";"239553"
"203210";"NY Wong Surgery";"3 Mount Elizabeth";"#09-02 Mt Elizabeth Medical Ctr.";"Singapore";"228510"
"200887";"The Bonham Clinic P/L-Dr David Eu";"100 Peck Seah Street";"#11-16/17";"Singapore";"079333"
"202315";"Raffles Hospital Pte Ltd";"585 North Bridge Rd.";"#07-00 Pharmacy Department";"Singapore";"188770"
"201452";"Yap Medicare Clinic & Surgery- Dr Yap Boh Wei";"Block 8 Empress Rd.";"#01-03";"Singapore";"260008"
"400185";"National Healthcare Grp Pharm.- Pharmacy Service C";"10 Buangkok View";"Blk 9 ,L1 Buangkok Green Med Park (IMH)";"Singapore";"539747"
"100002";"Tan Tock Seng Hospital Pte Ltd";"Moulmein Rd.";"Pharmacy Dept";"Singapore";"308087"
"D64903";"Ng Teng Fong General Hospital";"No 1 Jurong East Street 21";"";"Singapore";"609606"
"201420";"Lifecare Family Clinic & Surgery-Dr Seng Tee Kiat";"Block 106 Hougang Avenue 1";"#01-1221";"Singapore";"530106"
"200401";"The Ming Clinic";"1 Orchard Boulevard";"#04-01/02 Camden Medical Ctr.";"Singapore";"248649"
"400032";"Pan-Malayan Pharmaceuticals Pte Ltd";"16 Tai Seng Street";"Level 4";"Singapore";"534138"
"203388";"The Psychological Wellness Ctr.";"101 Irrawaddy Road";"#13-07 Royal Square At Novena";"Singapore";"329565"
"203388";"The Psychological Wellness Ctr.";"101 Irrawaddy Road";"#13-07 Royal Square At Novena";"Singapore";"329565"
"203478";"Lim Ing Haan Cardiology Pte Ltd";"3 Mount Elizabeth";"#04-02 Mt Elizabeth Medical Ctr.";"Singapore";"228510"
"200903";"Neo Clinic & Surgery- Dr Neo Eng Kiong";"Block 257 Bangkit Rd.";"#01-45";"Singapore";"670257"
"200157";"Eastern Clinic & Surgery P/L-Dr Tan Chin Hor";"Block 235 Jurong East St. 21";"#01-316";"Singapore";"600235"
"I02142";"Prime Heart Centre Pte Ltd c/oPrime Heart Centre";"6A Napier Rd.";"#03-37C Gleneagles Hospital Annex Block";"Singapore";"258500"
"203024";"Raffles Japanese Clinic Pte Ltd c/o Raffles Hospit";"585 North Bridge Rd.";"#11-00 Raffles Hospital";"Singapore";"188770"
"202391";"HS Chan Surgery Pte Ltd";"6 Napier Road";"#03-37D Gleneagles Hospital Annex Block";"Singapore";"258499"
"300118";"Parkway Hospitals (S) Pte Ltd c/o Mount E Novena H";"Tower 5, Connection One";"Blk 167 Jalan Bukit Merah #16-10";"Singapore";"150167"
"200133";"Civic Clinic - Dr Ooi Teik Huat";"Block 537 Bedok North St. 3";"#01-515";"Singapore";"460537"
"203459";"EH Heart Specialist P/L- Dr Eric Hong";"3 Mount Elizabeth";"#03-09 Mt Elizabeth Medical Ctr.";"Singapore";"228510"
"200886";"Neighbourhood Clinic- Dr Lim Yu Her";"Block 260 Bangkit Rd.";"#01-13 Bkt. Panjang Neighbourhood Ctr";"Singapore";"670260"
"200656";"Victory Clinic & Surgery Pte Ltd Dr William Khoo C";"21 Ghim Moh Rd.";"#01-205";"Singapore";"270021"
"F10783";"Raffles Medical Group Ltd";"Block 118 Holland Avenue";"#05-02/03 Raffles Holland V";"Singapore";"278997"
"100030";"National University Hospital (S) Pte Ltd";"5 Lower Kent Ridge Rd.";"";"Singapore";"119074"
"100004";"Singapore General Hospital Pte Ltd";"2 Bukit Merah Central #11-01";"1FSS Pte Ltd";"Singapore";"159835"
"200021";"Thomas Clinic & Surgery- Dr Thomas Cherian";"Block 61 Telok Blangah Heights";"#01-97";"Singapore";"100061"
"201021";"CityMed Health Associates P/L-Dr Chan Suen Meng";"19 Keppel Rd.";"#01-01 Jit Poh Bldg. Ground Floor";"Singapore";"089058"
"200503";"Rochor Clinic Pte Ltd";"175 Bencoolen Street";"#01-20 Burlington Square";"Singapore";"189649"
"200021";"Thomas Clinic & Surgery- Dr Thomas Cherian";"Block 61 Telok Blangah Heights";"#01-97";"Singapore";"100061"
"202315";"Raffles Hospital Pte Ltd";"585 North Bridge Rd.";"#07-00 Pharmacy Department";"Singapore";"188770"
"201520";"Susan Quek Heart Care Clinic- Dr Susan Quek";"3 Mount Elizabeth";"#15-14 Mt Elizabeth Medical Ctr.";"Singapore";"228510"
"203521";"Ho Kok Sun Colorectal Pte Ltd";"3 Mount Elizabeth";"#12-09 Mt Elizabeth Medical Ctr.";"Singapore";"228510"
"201843";"Health Partners Medical Clinic (Siglap)Dr Ho Jee";"23 Upper East Coast Road";"Crescendo Bldg.";"Singapore";"455289"
"201520";"Susan Quek Heart Care Clinic- Dr Susan Quek";"3 Mount Elizabeth";"#15-14 Mt Elizabeth Medical Ctr.";"Singapore";"228510"
"203610";"Quah Hak Mien Colorectal Ctr. P/L";"6 Napier Rd.";"#07-05 Gleneagles Medical Ctr.";"Singapore";"258499"
"D67787";"ESC Cardiovascular & Medicine Clinic C/O Kings Car";"1 Farrer Park Station Road";"#15-01 Farrer Park Hospital, Connexion";"Singapore";"217562"
"201230";"Newcastle Clinic c/o Newcastle Clinic Pte Ltd";"541 Orchard Road";"#18-02A Liat Towers";"Singapore";"238881"
"200963";"The Cardiac Centre Pte Ltd - Dr Leslie Lam";"1 Farrer Park Station Road";"#07-17 ConnexionTHE CARDIAC CENTRE";"Singapore";"217562"
"201219";"K K Tan Medical Clinic- Dr Tan Kok Kheng";"Block 284 Bishan St. 22";"#01-209";"Singapore";"570284"
"201520";"Susan Quek Heart Care Clinic- Dr Susan Quek";"3 Mount Elizabeth";"#15-14 Mt Elizabeth Medical Ctr.";"Singapore";"228510"
"201520";"Susan Quek Heart Care Clinic- Dr Susan Quek";"3 Mount Elizabeth";"#15-14 Mt Elizabeth Medical Ctr.";"Singapore";"228510"
"805040";"Drs Bain & Partners LLP";"1 Raffles Quay";"#09-03 One Raffles Quay North Tower";"Singapore";"048583"
"201754";"Jo-Lin Pte Ltd-Dr Josephine Lee c/o Jo-Lin Family";"Block 533 Choa Chu Kang St. 51";"#01-29 Limbang Shopping Centre";"Singapore";"680533"
"200347";"Loh's Clinic - Dr Loh Hung Ghee";"Block 45 Sims Drive";"#01-166";"Singapore";"380045"
"201960";"First Medical Ctr Pte Ltd -Dr Wang Joon Leong";"Block 169 Stirling Rd.";"#01-1165";"Singapore";"140169"
"805040";"Drs Bain & Partners LLP";"1 Raffles Quay";"#09-03 One Raffles Quay North Tower";"Singapore";"048583"
"400032";"Pan-Malayan Pharmaceuticals Pte Ltd";"16 Tai Seng Street";"Level 4";"Singapore";"534138"
"400032";"Pan-Malayan Pharmaceuticals Pte Ltd";"16 Tai Seng Street";"Level 4";"Singapore";"534138"
"201097";"Tampines Medilife Clinic- Dr Tan Ee Poh";"Block 801 Tampines Avenue 4";"#01-263";"Singapore";"520801"
"805040";"Drs Bain & Partners LLP";"1 Raffles Quay";"#09-03 One Raffles Quay North Tower";"Singapore";"048583"
"200887";"The Bonham Clinic P/L-Dr David Eu";"100 Peck Seah Street";"#11-16/17";"Singapore";"079333"
"202850";"Age-Link Specialist Clinic For Older Persons";"3 Mount Elizabeth";"#11-02 Mt Elizabeth Medical Ctr.";"Singapore";"228510"
"200478";"Frontier People's Clinic Pte Ltd";"Block 123 Bedok North St. 2";"#01-152";"Singapore";"460123"
"203748";"Dr BL Lim Ctr For Psychological Wellness P/L";"6 Napier Rd.";"#09-09 Gleneagles Medical Ctr.";"Singapore";"258499"
"201843";"Health Partners Medical Clinic (Siglap)Dr Ho Jee";"23 Upper East Coast Road";"Crescendo Bldg.";"Singapore";"455289"
"203021";"The Singapore Clinic For Kidney Diseases P/L";"3 Mount Elizabeth";"#08-01 Mt Elizabeth Medical Ctr.";"Singapore";"228510"
"200205";"Gwee Endocrine & Medical Clinic- Dr Gwee Hak Meng";"3 Mount Elizabeth";"#16-05 Mt Elizabeth Medical Ctr.";"Singapore";"228510"
"202188";"Central (Clinic + Surgery) Marine Parade";"Block 81 Marine Parade Central";"#01-630";"Singapore";"440081"
"200689";"Woodlands Clinic - Dr Gabriel Seow";"Block 131 Marsiling Rise";"#01-204";"Singapore";"730131"
"200987";"Central Medical Group P/L- Dr Lim Geok Leong";"Block 11 Jalan Bukit Merah";"#01-4442";"Singapore";"150011"
"203798";"Novena Cancer Ctr. Pte Ltd";"38 Irrawaddy Rd. #09-41 Novena";"Cancer Ctr, Mt E Novena Specialis";"Singapore";"329563"
"201251";"Lifecare Family Clinic & Surgery-Dr Lee Boon Siong";"Block 102 Yishun Avenue 5";"#01-133";"Singapore";"760102"
"100342";"Alexandra Health Pte Ltd c/o Khoo Teck Puat Hospit";"";"90 Yishun Central";"Singapore";"768828"
"202257";"LD Heart Clinic Pte Ptd c/o LD Heart Clinic";"6A Napier Rd.";"#03-37A Gleneagles Hospital Annexe Blk";"Singapore";"258500"
"202667";"Charles Chan Heart Clinic Pte Ltd";"6 Napier Rd. Suite 02-02";"Gleneagles Medical Ctr.";"Singapore";"258499"
"D63903";"Heart Matters Medical Centre PteLtd";"38 Irrawaddy Road";"#07-30 Mount. E Novena Specialist Ctr";"Singapore";"329563"
"E70909";"RafflesSpecialists";"1 Scotts Road";"#05-01 to #05-11 Shaw Centre";"Singapore";"228208"
"202684";"Leonard Koh Clinic Pte Ltd";"6 Napier Rd.";"#04-12 Gleneagles Medical Ctr.";"Singapore";"258499"
"202692";"KH Mak Heart Clinic P/L- Dr Mak Koon Hou";"6 Napier Rd.";"#08-13 Gleneagles Medical Ctr.";"Singapore";"258499"
"203662";"Raffles Medical Group";"50 Raffles Place";"#01-02A Singapore Land Tower";"Singapore";"048623"
"203889";"Raffles Medical Group Ltd White Sands";"1 Pasir Ris Central Street 3";"#04-19 White Sands Shopping Centre";"Singapore";"518457"
"202819";"Raffles Medical Group-Harbour Front";"1 Maritime Square";"#03-56 The Harbour Front";"Singapore";"099253"
"201681";"Raffles Medical Group Ltd";"55 Siglap Rd.";"#02-11/12 Siglap Ctr.";"Singapore";"455871"
"201722";"Raffles Medical Group Ltd";"930 Yishun Avenue 2";"#03-35 Northpoint Shopping Ctr.";"Singapore";"769098"
"203520";"NEX Healthcare Pte Ltd";"994 Bendemeer Rd.";"#06-09 B Central";"Singapore";"339943"
"203149";"Raffles Executive Medical Centre c/o Raffles Medic";"585 North Bridge Rd.";"#12-00 Raffles Hospital";"Singapore";"188770"
"100105";"National Heart Ctr Of Singapore Pte Ltd";"5 Hospital Drive (Pharmacy Dept)";"";"Singapore";"169609"
"100105";"National Heart Ctr Of Singapore Pte Ltd";"5 Hospital Drive (Pharmacy Dept)";"";"Singapore";"169609"
"200246";"Japan Clinic & Surgery- Dr Chee Weng Sun";"Block 802 French Rd.";"#01-55";"Singapore";"200802"
"201802";"Lee & Koh Family Clinic- Dr Karen Lee";"Block 359 Bukit Batok St. 31";"#01-389";"Singapore";"650359"
"G00173";"NgTayMengGastrointestinalHepatology Ctr c/oNgTayMe";"820 Thomson Road";"#06-01 Mt Alvernia Medical Ctr Block A";"Singapore";"574623"
"201469";"J J Clinic & Surgery- Dr Lan Jiann Jong";"Block 107 Ang Mo Kio Avenue 4";"#01-150";"Singapore";"560107"
"400050";"H C P Pte Ltd";"150 Orchard Road";"#04-06 Orchard Plaza";"Singapore";"238841"
"201469";"J J Clinic & Surgery- Dr Lan Jiann Jong";"Block 107 Ang Mo Kio Avenue 4";"#01-150";"Singapore";"560107"
"201742";"K N Chin & Associates P/L- Dr Michel Foo S N";"3 Temasek Boulevard";"#02-400 Suntec City Mall";"Singapore";"038983"
"D63831";"The Heart And Vascular Centre P/L";"3 Mount Elizabeth";"#08-06 Mount Elizabeth Medical Centre";"Singapore";"228510"
"200590";"Teban Garden Clinic-Dr Chew Pin Kee";"Block 61 Teban Garden Rd.";"#01-01 Teban Place";"Singapore";"600061"
"201237";"Tanamera Clinic- Dr Koh Chong Cheng";"Block 73 Bedok South Avenue 3";"#01-462";"Singapore";"460073"
"200154";"Dover Clinic & Surgery- Dr Chew Gian Moh";"Block 28 Dover Crescent";"#01-89 Multi Storey Car Park";"Singapore";"130028"
"203819";"Providence Clinic @REDHILL";"Blk 86 #01-596";"Rehill CloseProvidence Clinic";"Singapore";"150086"
"200246";"Japan Clinic & Surgery- Dr Chee Weng Sun";"Block 802 French Rd.";"#01-55";"Singapore";"200802"
"201241";"Shalom Medical Group- Dr Vincent Tok Choo Beng";"231 Bain St.";"#03-57 Bras Basah Complex";"Singapore";"180231"
"202623";"Stephen Chew Ctr For Kidney Disease & Hypertens";"3 Mount Elizabeth";"#13-05 Mt Elizabeth Medical Ctr.";"Singapore";"228510"
"802800";"W.P. Sim Family Clinic & Surg- Dr Sim Wee Peng";"Blk 153 Serangoon North Ave. 1";"#01-548";"Singapore";"550153"
"201940";"Healthway Tampines Clinic-Dr Philip Koh Kheng Keah";"Block 710 Tampines St. 71";"#01-134";"Singapore";"520710"
"D63831";"The Heart And Vascular Centre P/L";"3 Mount Elizabeth";"#08-06 Mount Elizabeth Medical Centre";"Singapore";"228510"
"201091";"Healthway Medical Clinic";"Block 960 Jurong West St. 92";"#01-166";"Singapore";"640960"
"D63831";"The Heart And Vascular Centre P/L";"3 Mount Elizabeth";"#08-06 Mount Elizabeth Medical Centre";"Singapore";"228510"
"D63831";"The Heart And Vascular Centre P/L";"3 Mount Elizabeth";"#08-06 Mount Elizabeth Medical Centre";"Singapore";"228510"
"200305";"Lee Clinic & Surgery- Dr Lee Keen Khuen";"Block 333 Kreta Ayer Rd.";"#01-20";"Singapore";"080333"
"201895";"HL Clinic-Dr Sabrina Lim Seok Cheng";"Block 9 Telok Blangah Crescent";"#01-135";"Singapore";"090012"
"901119";"Guardian H & B- 127 Paragon";"290 Orchard Rd.";"#B1-20/24 Paragon";"Singapore";"238859"
"202692";"KH Mak Heart Clinic P/L- Dr Mak Koon Hou";"6 Napier Rd.";"#08-13 Gleneagles Medical Ctr.";"Singapore";"258499"
"201564";"Koo Cardiac Clinic- Dr Koo Chee Choong";"6 Napier Rd.";"#02-15 Gleneagles Medical Ctr.";"Singapore";"258499"
"200368";"Marine Parade Clinic- Dr Kong Kum Leng";"Block 59 Marine Terrace";"#01-81";"Singapore";"440059"
"201462";"Yeo Neurology & Clinical Neurophysiology-Dr PT Yeo";"101 Irrawaddy Road";"#13-06 Royal Square@Novena";"Singapore";"329565"
"201775";"Premier Healthcare Clinic & Surgery-Dr Wong Jansen";"Block 376 Bukit Batok St. 31";"#01-106";"Singapore";"650376"
"202315";"Raffles Hospital Pte Ltd";"585 North Bridge Rd.";"#07-00 Pharmacy Department";"Singapore";"188770"
"202162";"First Care Family Clinic- Dr Low Chin Yong";"Block 253 Jurong East St. 24";"#01-257";"Singapore";"600253"
"200715";"Tan-Teoh Clinic/Surgery-Dr Tan C L/Dr Teoh S H";"Block 101 Towner Rd.";"#01-216";"Singapore";"322101"
"F20749";"Gramercy Heart and Vascular Ctr c/o Gramercy Heart";"38 Irrawaddy Road";"#05-45";"Singapore";"329563"
"400032";"Pan-Malayan Pharmaceuticals Pte Ltd";"16 Tai Seng Street";"Level 4";"Singapore";"534138"
"400032";"Pan-Malayan Pharmaceuticals Pte Ltd";"16 Tai Seng Street";"Level 4";"Singapore";"534138"
"I11317";"ALPS Pte Ltd c/o FSS - Accounts Payables";"Bukit Merah Central Post Office";"PO Box 543";"Singapore";"911532"
"900234";"Guardian H & B- 006 Parkway Parade";"80 Marine Parade Rd.";"#B1-84 Parkway Parade";"Singapore";"449269"
"804152";"Eastern Clinic & Surgery P/L- Dr Tan Chin Hor";"Block 318 Jurong East St. 31";"#01-48";"Singapore";"600318"
"200887";"The Bonham Clinic P/L-Dr David Eu";"100 Peck Seah Street";"#11-16/17";"Singapore";"079333"
"400032";"Pan-Malayan Pharmaceuticals Pte Ltd";"16 Tai Seng Street";"Level 4";"Singapore";"534138"
"200154";"Dover Clinic & Surgery- Dr Chew Gian Moh";"Block 28 Dover Crescent";"#01-89 Multi Storey Car Park";"Singapore";"130028"
"201499";"Evercare Medical Clinic- Dr Chui Peng Leong";"Block 253 Choa Chu Kang Avenue 1";"#01-14A";"Singapore";"680253"
"200121";"Rowell Clinic & Surgery- Dr Sng Lui Cheng";"Block 642 Rowell Rd.";"#01-115";"Singapore";"200642"
"201473";"Familycare Clinic And Surgery- Dr Soo Ing Choong";"Block 85C Lorong 4 Toa Payoh";"#01-380";"Singapore";"313085"
"201003";"Shalom Clinic & Surgery- Dr Lawrence Soh Eng Liong";"Block 123 Bukit Merah Lane 1";"#01-104";"Singapore";"150123"
"201499";"Evercare Medical Clinic- Dr Chui Peng Leong";"Block 253 Choa Chu Kang Avenue 1";"#01-14A";"Singapore";"680253"
"201003";"Shalom Clinic & Surgery- Dr Lawrence Soh Eng Liong";"Block 123 Bukit Merah Lane 1";"#01-104";"Singapore";"150123"
"200478";"Frontier People's Clinic Pte Ltd";"Block 123 Bedok North St. 2";"#01-152";"Singapore";"460123"
"200248";"Jinmin Clinic - Dr Ho Soon Lye";"430 Changi Rd.";"";"Singapore";"419872"
"100097";"AMK-Thye Hua Kwan Hospital Ltd";"17 Ang Mo Kio Avenue 9";"";"Singapore";"569766"
"200203";"G.S. Clinic & Surgery P/L- Dr Goh H P/Dr Seah";"Block 632 Ang Mo Kio Avenue 4";"#01-960";"Singapore";"560632"
"200248";"Jinmin Clinic - Dr Ho Soon Lye";"430 Changi Rd.";"";"Singapore";"419872"
"I01728";"Pulse Clinic Pte Ltd";"Blk 38 Beo Crescent";"#01-32 The Beo Crescent";"Singapore";"160038"
"200203";"G.S. Clinic & Surgery P/L- Dr Goh H P/Dr Seah";"Block 632 Ang Mo Kio Avenue 4";"#01-960";"Singapore";"560632"
"202315";"Raffles Hospital Pte Ltd";"585 North Bridge Rd.";"#07-00 Pharmacy Department";"Singapore";"188770"
"201542";"Goh Hak Su Colon & Rectal Ctr- Dr Goh Hak Su";"6 Napier Rd.";"#04-08 Gleneagles Medical Ctr.";"Singapore";"258499"
"202541";"El Shaddai Arthritis & Rheumatism Specialist Medic";"102 Towner Rd.";"#01-258";"Singapore";"322102"
"202187";"The Heart Specialist Clinic- Dr Teo Wee Siong";"3 Mount Elizabeth";"#14-10 Mt Elizabeth Medical Ctr.";"Singapore";"228510"
"201236";"Peter Yan Medical Services P/L- Dr Peter Yan";"6 Napier Rd.";"#04-10 Gleneagles Medical Ctr.";"Singapore";"258499"
"201329";"Low Medical Clinic - Dr Low Kee Hwa";"Block 67 Kallang Bahru";"#01-447";"Singapore";"330067"
"201780";"OneLife Family Clinic-Dr Vincent Chow";"Block 534 Choa Chu Kang St. 51";"#01-41";"Singapore";"680534"
"D64903";"Ng Teng Fong General Hospital";"No 1 Jurong East Street 21";"";"Singapore";"609606"
"201754";"Jo-Lin Pte Ltd-Dr Josephine Lee c/o Jo-Lin Family";"Block 533 Choa Chu Kang St. 51";"#01-29 Limbang Shopping Centre";"Singapore";"680533"
"201036";"Goh Clinic & Surgery- Dr Malcolm Goh Chin Liang";"Block 204 Hougang St. 21";"#01-101";"Singapore";"530204"
"D66827";"Saint Julien Clinical Associates Pte Ltd";"820 Thomson Road";"#05-58 Mount Alvernia Hosp Medical Ctr D";"Singapore";"574623"
"D66827";"Saint Julien Clinical Associates Pte Ltd";"820 Thomson Road";"#05-58 Mount Alvernia Hosp Medical Ctr D";"Singapore";"574623"
"200590";"Teban Garden Clinic-Dr Chew Pin Kee";"Block 61 Teban Garden Rd.";"#01-01 Teban Place";"Singapore";"600061"
"201324";"JL Medical(Bkt Batok)P/L-Dr Janet Lee Yeng Fen";"Blk 413 Bkt Batok West Ave. 4";"#01-214";"Singapore";"650413"
"201276";"Family Healthcare Cl & Surgery- Dr Cheng Soo Hong";"Block 523 Hougang Avenue 6";"#01-119";"Singapore";"530523"
"805260";"E.J.Tan Clinic & Surgery- Dr Lim Chien Chuan";"Block 104 Jurong East St. 13";"#01-100";"Singapore";"600104"
"201775";"Premier Healthcare Clinic & Surgery-Dr Wong Jansen";"Block 376 Bukit Batok St. 31";"#01-106";"Singapore";"650376"
"201276";"Family Healthcare Cl & Surgery- Dr Cheng Soo Hong";"Block 523 Hougang Avenue 6";"#01-119";"Singapore";"530523"
"G53519";"Atlas Pacific Medical";"428 River Valley Road";"#01-10 Loft @ Nathan";"Singapore";"248327"
"200856";"Hong Family Clinic- Dr Hong Lee Tiong";"Block 282 Tampines St. 22";"#01-300";"Singapore";"520282"
"F20613";"The Clinic @ Business City c/o The Clinic @ Busine";"20 Pasir Panjang Road";"#02-26 Maple Tree Business City";"Singapore";"117439"
"201065";"T&T Family Health Clinic & Surgery- Dr Ting C M";"181 Kitchener Rd.";"#01-14 to 20 New ParkHotelShoppingArcade";"Singapore";"208533"
"203207";"Dr Warren Lee's Paediatrics, Growth & Diabetes Ctr";"1 Orchard Boulevard";"#02-06 Camden Med Ctr";"Singapore";"248649"
"100105";"National Heart Ctr Of Singapore Pte Ltd";"5 Hospital Drive (Pharmacy Dept)";"";"Singapore";"169609"
"900228";"Guardian H & B-Warehouse (Tampines)";"21 Tampines North Drive 2";"#03-01";"Singapore";"528765"
"200017";"AMK Medical Ctr. - Dr Tan Seung Po";"Block 157 Ang Mo Kio Avenue 4";"#01-558";"Singapore";"560157"
"200017";"AMK Medical Ctr. - Dr Tan Seung Po";"Block 157 Ang Mo Kio Avenue 4";"#01-558";"Singapore";"560157"
"400050";"H C P Pte Ltd";"150 Orchard Road";"#04-06 Orchard Plaza";"Singapore";"238841"
"805040";"Drs Bain & Partners LLP";"1 Raffles Quay";"#09-03 One Raffles Quay North Tower";"Singapore";"048583"
"201072";"Saw Baby & Child Clinic & Khoo Family Clinic";"Block 681 Hougang Avenue 8";"#01-827";"Singapore";"530681"
"201074";"Huan Clinic - Dr M W Huan";"Block 51 Chin Swee Rd.";"#03-111";"Singapore";"160051"
"200876";"Clinic CP Lim Pte Ltd";"319 Joo Chiat Place";"#02-05 Parkway East Medical Ctr.";"Singapore";"427989"
"I99892";"Leslie Tay Heart Specialist Pte Ltd Mount E Novena";"38 Irrawaddy Road";"#08-51";"Singapore";"329563"
"202227";"Chan KM Geriatric & Medical Clinic P/L";"6 Napier Rd.";"#08-10 Gleneagles Medical Ctr.";"Singapore";"258499"
"202967";"Parkway Shenton Pte Ltd";"47 Jalan Buroh";"#04-01";"Singapore";"619491"
"202967";"Parkway Shenton Pte Ltd";"47 Jalan Buroh";"#04-01";"Singapore";"619491"
"201036";"Goh Clinic & Surgery- Dr Malcolm Goh Chin Liang";"Block 204 Hougang St. 21";"#01-101";"Singapore";"530204"
"200017";"AMK Medical Ctr. - Dr Tan Seung Po";"Block 157 Ang Mo Kio Avenue 4";"#01-558";"Singapore";"560157"
"202967";"Parkway Shenton Pte Ltd";"47 Jalan Buroh";"#04-01";"Singapore";"619491"
"200749";"Comfort Clinic & Surgery";"Block 214 Serangoon Avenue 4";"#01-100";"Singapore";"550214"
"E05595";"The Clinic @ Capitagreen c/o The Clinic @ Capitagr";"138 Market Street";"#02-01A";"Singapore";"048946"
"202962";"Peter Eng Endocrine Clinic Pte Ltd";"3 Mount Elizabeth";"#10-07 Mt Elizabeth Medical Ctr.";"Singapore";"228510"
"100002";"Tan Tock Seng Hospital Pte Ltd";"Moulmein Rd.";"Pharmacy Dept";"Singapore";"308087"
"203453";"The Clinic @ One George Street";"1 George St.";"#05-05 (Lobby C)";"Singapore";"049145"
"200874";"Bernard Ee Medical Ctr P/L- c/o Bernard Ee Cardiac";"6 Napier Rd.";"#03-05 Gleneagles Medical Ctr.";"Singapore";"258499"
"203115";"TCI Cardiology Pte Ltd c/o Novena Heart Ctr";"38 Irrawaddy Road";"#07-56/57/58/59 Mt E Novena Spec Ctr";"Singapore";"329563"
"G52937";"Lai Endoscopy & Colorectal Surgery";"3 Mount Elizabeth";"#05-06 Mount Elizabeth Medical Centre";"Singapore";"228510"
"E06373";"Lian Clinic - Dr Jeffrey Loh";"18 Marsiling Lane";"#01-269";"Singapore";"730018"
"D67592";"KK Sng Colorectal & General Surgery Pte Ltd";"6 Napier Road";"#06-10 to 13 Gleneagles Medical Centre";"Singapore";"258499"
"200124";"Peter Chuah Clinic";"80 Marine Parade Rd.";"#04-03 Parkway Parade";"Singapore";"449269"
"203459";"EH Heart Specialist P/L- Dr Eric Hong";"3 Mount Elizabeth";"#03-09 Mt Elizabeth Medical Ctr.";"Singapore";"228510"
"201968";"Y S Lau Cardiology Clinic P/L-Dr Lau Yung Sang";"820 Thomson Rd.";"#06-69 Mt Alvernia Medical Ctr D";"Singapore";"574623"
"D33670";"Family Medicine Clinic Chinatown";"133 New Bridge Road";"#02-09 Chinatown Point";"Singapore";"059413"
"901594";"Guardian H & B- 231 Hougang Mall";"90 Hougang Avenue 10";"#B1-31 Hougang Mall Shopping Ctr.";"Singapore";"538766"
"201219";"K K Tan Medical Clinic- Dr Tan Kok Kheng";"Block 284 Bishan St. 22";"#01-209";"Singapore";"570284"
"400002";"A.M. Pharmacy (Pte) Ltd";"150 Orchard Rd.";"#04-06 Orchard Plaza";"Singapore";"238841"
"100002";"Tan Tock Seng Hospital Pte Ltd";"Moulmein Rd.";"Pharmacy Dept";"Singapore";"308087"
"I02142";"Prime Heart Centre Pte Ltd c/oPrime Heart Centre";"6A Napier Rd.";"#03-37C Gleneagles Hospital Annex Block";"Singapore";"258500"
"I02142";"Prime Heart Centre Pte Ltd c/oPrime Heart Centre";"6A Napier Rd.";"#03-37C Gleneagles Hospital Annex Block";"Singapore";"258500"
"D33670";"Family Medicine Clinic Chinatown";"133 New Bridge Road";"#02-09 Chinatown Point";"Singapore";"059413"
"200203";"G.S. Clinic & Surgery P/L- Dr Goh H P/Dr Seah";"Block 632 Ang Mo Kio Avenue 4";"#01-960";"Singapore";"560632"
"200698";"Yang & Yap Clinic & Surgery Pte Ltd";"Block 537 Bedok North St. 3";"#01-571";"Singapore";"460537"
"400002";"A.M. Pharmacy (Pte) Ltd";"150 Orchard Rd.";"#04-06 Orchard Plaza";"Singapore";"238841"
"400002";"A.M. Pharmacy (Pte) Ltd";"150 Orchard Rd.";"#04-06 Orchard Plaza";"Singapore";"238841"
"D33670";"Family Medicine Clinic Chinatown";"133 New Bridge Road";"#02-09 Chinatown Point";"Singapore";"059413"
"201065";"T&T Family Health Clinic & Surgery- Dr Ting C M";"181 Kitchener Rd.";"#01-14 to 20 New ParkHotelShoppingArcade";"Singapore";"208533"
"D64903";"Ng Teng Fong General Hospital";"No 1 Jurong East Street 21";"";"Singapore";"609606"
"400050";"H C P Pte Ltd";"150 Orchard Road";"#04-06 Orchard Plaza";"Singapore";"238841"
"100060";"Changi General Hospital Pte Ltd";"2 Simei St. 3";"";"Singapore";"529889"
"201319";"B S Chew Clinic - Dr Chew Ban Soon";"Block 252 Jurong East St. 24";"#01-109";"Singapore";"600252"
"400032";"Pan-Malayan Pharmaceuticals Pte Ltd";"16 Tai Seng Street";"Level 4";"Singapore";"534138"
"202595";"Loh Keh Chuan Diabetes, Thyroid & Hormone Clinic";"3 Mount Elizabeth";"#10-05 Mt Elizabeth Medical Ctr.";"Singapore";"228510"
"203210";"NY Wong Surgery";"3 Mount Elizabeth";"#09-02 Mt Elizabeth Medical Ctr.";"Singapore";"228510"
"D33717";"Farrer Park Hospital Pte Ltd";"1 Farrer Park Station Road";"#02-01 Connexion";"Singapore";"217562"
"F10849";"Raffles Medical Group Ltd";"20 Airport Boulevard";"Sats Inflight Catering Centre 1";"Singapore";"819659"
"202379";"MinMed Clinic(Haig Road) c/o Ministry Medical Grou";"30 Haig Rd.";"SingaporeDAYSPRING MED";"Singapore";"438737"
"H55657";"Jireh Heart Centre Pte Ltd c/o Jireh Heart Centre";"38 Irrawaddy Road";"#06-63 Mt Elizabeth Novena SpecialistCtr";"Singapore";"329563"
"D33547";"Apex Heart Clinic";"6A Napier Road";"#04-37 Annex Block Gleneagle";"Singapore";"258500"
"202458";"The Heart Clinic- Dr Koh Siam Soon Philip";"3 Mount Elizabeth";"#13-15 Mt Elizabeth Medical Ctr.";"Singapore";"228510"
"203270";"Thomson Women Cancer Ctr. Pte Ltd";"10 Sinaran Drive";"#09-15/16 Square 2 Novena Medical Center";"Singapore";"307506"
"202315";"Raffles Hospital Pte Ltd";"585 North Bridge Rd.";"#07-00 Pharmacy Department";"Singapore";"188770"
"200037";"Bedok Medical Ctr Pte Ltd Dr Chua Lee Lea Im";"Block 18 Bedok South Rd.";"#01-57";"Singapore";"460018"
"E04589";"Better Life Psychological Medicine Clinic c/o Bett";"10 Sinaran Drive";"#08-17/30 Novena Medical Centre";"Singapore";"307506"
"202939";"Fones Clinic c/o PsyMed Consultants Pte Ltd";"6 Napier Rd.";"#04-11 Gleneagles Medical Ctr.";"Singapore";"258499"
"202595";"Loh Keh Chuan Diabetes, Thyroid & Hormone Clinic";"3 Mount Elizabeth";"#10-05 Mt Elizabeth Medical Ctr.";"Singapore";"228510"
"203745";"OneDoctors Healthcare Pte Ltd";"Block 846 Yishun Ring Rd.";"#01-3611";"Singapore";"760846"
"202595";"Loh Keh Chuan Diabetes, Thyroid & Hormone Clinic";"3 Mount Elizabeth";"#10-05 Mt Elizabeth Medical Ctr.";"Singapore";"228510"
"900228";"Guardian H & B-Warehouse (Tampines)";"21 Tampines North Drive 2";"#03-01";"Singapore";"528765"
"200674";"Wong Clinic - Dr Wong Chin Heng";"Block 539 Bedok North St. 3";"#01-603";"Singapore";"460539"
"200670";"Winstedt Clinic - Dr S L Sarma";"51 Upper Weld Rd.";"(Little India)";"Singapore";"207408"
"200670";"Winstedt Clinic - Dr S L Sarma";"51 Upper Weld Rd.";"(Little India)";"Singapore";"207408"
